{
  "availability": "available",
  "canonical_scale": 1,
  "company": {
    "company_id": "cn_300207",
    "country_code": "CN",
    "exchange": "SZSE",
    "legal_name": "欣旺达电子股份有限公司",
    "ticker": "300207"
  },
  "created_at": "2026-09-01T05:30:00+08:00",
  "currency": "CNY",
  "fact_id": "fact_v14_sunwoda_2024h1_inventory",
  "fact_kind": "reported",
  "measurement_unit": "CURRENCY",
  "metric_code": "inventory",
  "period": {
    "accounting_standard": "CAS",
    "fiscal_period": "H1",
    "fiscal_year": 2024,
    "period_basis": "instant",
    "period_end": "2024-06-30",
    "period_start": "2024-06-30",
    "restatement_status": "as_reported",
    "statement_scope": "consolidated"
  },
  "quality_flags": [
    "unit_normalized"
  ],
  "schema_version": "1.4.0",
  "sign_convention": "natural_statement_value",
  "source": {
    "content_hash": "621c89394f5d0e4c618f9c83cc29cbf8f8c1d53c9985c048e7779f47c74a6158",
    "document_id": "doc_v14_sunwoda_2024h1",
    "license_id": null,
    "published_at": "2024-08-30T23:59:59+08:00",
    "redistribution_allowed": false,
    "retrieved_at": "2026-09-01T04:40:00+08:00",
    "source_id": "source_cninfo",
    "source_type": "official_filing",
    "uri": "https://static.cninfo.com.cn/finalpage/2024-08-30/1221053778.PDF"
  },
  "source_locator": {
    "column_label": "报告期末",
    "page": 62,
    "row_label": "存货",
    "section": "财务报表",
    "table": "合并资产负债表"
  },
  "value": "7384879099.91"
}
