{
  "availability": "available",
  "canonical_scale": 1,
  "company": {
    "company_id": "cn_002074",
    "country_code": "CN",
    "exchange": "SZSE",
    "legal_name": "国轩高科股份有限公司",
    "ticker": "002074"
  },
  "created_at": "2026-09-01T05:30:00+08:00",
  "currency": "CNY",
  "fact_id": "fact_v14_gotion_2024q1_net_income",
  "fact_kind": "reported",
  "measurement_unit": "CURRENCY",
  "metric_code": "net_income",
  "period": {
    "accounting_standard": "CAS",
    "fiscal_period": "Q1",
    "fiscal_year": 2024,
    "period_basis": "ytd",
    "period_end": "2024-03-31",
    "period_start": "2024-01-01",
    "restatement_status": "as_reported",
    "statement_scope": "consolidated"
  },
  "quality_flags": [
    "unit_normalized"
  ],
  "schema_version": "1.4.0",
  "sign_convention": "natural_statement_value",
  "source": {
    "content_hash": "971ef3c995416a4074bbfab8eea8a511d5ca1016e4576f79548a47a34eaa1fab",
    "document_id": "doc_v14_gotion_2024q1",
    "license_id": null,
    "published_at": "2024-04-20T23:59:59+08:00",
    "redistribution_allowed": false,
    "retrieved_at": "2026-09-01T04:40:00+08:00",
    "source_id": "source_cninfo",
    "source_type": "official_filing",
    "uri": "https://static.cninfo.com.cn/finalpage/2024-04-20/1219701032.PDF"
  },
  "source_locator": {
    "column_label": "本期/年初至报告期末",
    "page": 9,
    "row_label": "归属于母公司股东/所有者的净利润",
    "section": "财务报表",
    "table": "合并利润表"
  },
  "value": "69137964.65"
}
