{
  "availability": "available",
  "canonical_scale": 1,
  "company": {
    "company_id": "cn_300438",
    "country_code": "CN",
    "exchange": "SZSE",
    "legal_name": "广州鹏辉能源科技股份有限公司",
    "ticker": "300438"
  },
  "created_at": "2026-09-01T14:30:00+08:00",
  "currency": "CNY",
  "fact_id": "fact_v15_greatpower_2023fy_net_income",
  "fact_kind": "reported",
  "measurement_unit": "CURRENCY",
  "metric_code": "net_income",
  "period": {
    "accounting_standard": "CAS",
    "fiscal_period": "FY",
    "fiscal_year": 2023,
    "period_basis": "ytd",
    "period_end": "2023-12-31",
    "period_start": "2023-01-01",
    "restatement_status": "as_reported",
    "statement_scope": "consolidated"
  },
  "quality_flags": [
    "unit_normalized"
  ],
  "schema_version": "1.4.0",
  "sign_convention": "natural_statement_value",
  "source": {
    "content_hash": "824151efba6a010c2a66a8728ae8c640ad67d9147b8ea891323b12e9cb45422f",
    "document_id": "doc_v15_greatpower_2023fy",
    "license_id": null,
    "published_at": "2024-04-27T23:59:59+08:00",
    "redistribution_allowed": false,
    "retrieved_at": "2026-09-01T14:00:00+08:00",
    "source_id": "source_cninfo",
    "source_type": "official_filing",
    "uri": "https://static.cninfo.com.cn/finalpage/2024-04-27/1219864805.PDF"
  },
  "source_locator": {
    "column_label": "本期/年初至报告期末",
    "page": 88,
    "row_label": "归属于母公司股东/所有者的净利润",
    "section": "财务报表",
    "table": "合并利润表"
  },
  "value": "43102038.12"
}
