{
  "availability": "available",
  "canonical_scale": 1,
  "company": {
    "company_id": "cn_688567",
    "country_code": "CN",
    "exchange": "SSE",
    "legal_name": "孚能科技（赣州）股份有限公司",
    "ticker": "688567"
  },
  "created_at": "2026-09-01T14:30:00+08:00",
  "currency": "CNY",
  "fact_id": "fact_v15_farasis_2023q3_inventory",
  "fact_kind": "reported",
  "measurement_unit": "CURRENCY",
  "metric_code": "inventory",
  "period": {
    "accounting_standard": "CAS",
    "fiscal_period": "Q3",
    "fiscal_year": 2023,
    "period_basis": "instant",
    "period_end": "2023-09-30",
    "period_start": "2023-09-30",
    "restatement_status": "as_reported",
    "statement_scope": "consolidated"
  },
  "quality_flags": [
    "unit_normalized"
  ],
  "schema_version": "1.4.0",
  "sign_convention": "natural_statement_value",
  "source": {
    "content_hash": "b940bc01990ceeb84a552b7882d173015394f0741d4e185b2dbd1482caf2c841",
    "document_id": "doc_v15_farasis_2023q3",
    "license_id": null,
    "published_at": "2023-10-28T23:59:59+08:00",
    "redistribution_allowed": false,
    "retrieved_at": "2026-09-01T14:00:00+08:00",
    "source_id": "source_cninfo",
    "source_type": "official_filing",
    "uri": "https://static.cninfo.com.cn/finalpage/2023-10-28/1218191393.PDF"
  },
  "source_locator": {
    "column_label": "报告期末",
    "page": 7,
    "row_label": "存货",
    "section": "财务报表",
    "table": "合并资产负债表"
  },
  "value": "4570413708.16"
}
