{
  "availability": "available",
  "canonical_scale": 1,
  "company": {
    "company_id": "cn_688772",
    "country_code": "CN",
    "exchange": "SSE",
    "legal_name": "珠海冠宇电池股份有限公司",
    "ticker": "688772"
  },
  "created_at": "2026-09-01T14:30:00+08:00",
  "currency": "CNY",
  "fact_id": "fact_v15_cosmx_2024h1_operating_cash_flow",
  "fact_kind": "reported",
  "measurement_unit": "CURRENCY",
  "metric_code": "operating_cash_flow",
  "period": {
    "accounting_standard": "CAS",
    "fiscal_period": "H1",
    "fiscal_year": 2024,
    "period_basis": "ytd",
    "period_end": "2024-06-30",
    "period_start": "2024-01-01",
    "restatement_status": "as_reported",
    "statement_scope": "consolidated"
  },
  "quality_flags": [
    "unit_normalized"
  ],
  "schema_version": "1.4.0",
  "sign_convention": "natural_statement_value",
  "source": {
    "content_hash": "a0318082876b630ffc30af2b7d8fa1b4bcddb6be4b58a1a1be11b03924c830e7",
    "document_id": "doc_v15_cosmx_2024h1",
    "license_id": null,
    "published_at": "2024-08-16T23:59:59+08:00",
    "redistribution_allowed": false,
    "retrieved_at": "2026-09-01T14:00:00+08:00",
    "source_id": "source_cninfo",
    "source_type": "official_filing",
    "uri": "https://static.cninfo.com.cn/finalpage/2024-08-16/1220880041.PDF"
  },
  "source_locator": {
    "column_label": "本期/年初至报告期末",
    "page": 79,
    "row_label": "经营活动产生的现金流量净额",
    "section": "财务报表",
    "table": "合并现金流量表"
  },
  "value": "836099645.81"
}
