{
  "availability": "available",
  "canonical_scale": 1,
  "company": {
    "company_id": "cn_002074",
    "country_code": "CN",
    "exchange": "SZSE",
    "legal_name": "国轩高科股份有限公司",
    "ticker": "002074"
  },
  "created_at": "2026-09-01T05:30:00+08:00",
  "currency": "CNY",
  "fact_id": "fact_v14_gotion_2024q3_inventory",
  "fact_kind": "reported",
  "measurement_unit": "CURRENCY",
  "metric_code": "inventory",
  "period": {
    "accounting_standard": "CAS",
    "fiscal_period": "Q3",
    "fiscal_year": 2024,
    "period_basis": "instant",
    "period_end": "2024-09-30",
    "period_start": "2024-09-30",
    "restatement_status": "as_reported",
    "statement_scope": "consolidated"
  },
  "quality_flags": [
    "unit_normalized"
  ],
  "schema_version": "1.4.0",
  "sign_convention": "natural_statement_value",
  "source": {
    "content_hash": "b024c7b32388cc212506acdb788548cf3aaff831a32bf85f2dbe2edbcd618049",
    "document_id": "doc_v14_gotion_2024q3",
    "license_id": null,
    "published_at": "2024-10-30T23:59:59+08:00",
    "redistribution_allowed": false,
    "retrieved_at": "2026-09-01T04:40:00+08:00",
    "source_id": "source_cninfo",
    "source_type": "official_filing",
    "uri": "https://static.cninfo.com.cn/finalpage/2024-10-30/1221557518.PDF"
  },
  "source_locator": {
    "column_label": "报告期末",
    "page": 6,
    "row_label": "存货",
    "section": "财务报表",
    "table": "合并资产负债表"
  },
  "value": "6267099390.70"
}
