{
  "availability": "available",
  "canonical_scale": 1,
  "company": {
    "company_id": "cn_300014",
    "country_code": "CN",
    "exchange": "SZSE",
    "legal_name": "惠州亿纬锂能股份有限公司",
    "ticker": "300014"
  },
  "created_at": "2026-08-30T22:30:00+08:00",
  "currency": "CNY",
  "fact_id": "fact_g0_eve_2024h1_corrected_revenue",
  "fact_kind": "reported",
  "measurement_unit": "CURRENCY",
  "metric_code": "revenue",
  "period": {
    "accounting_standard": "CAS",
    "fiscal_period": "H1",
    "fiscal_year": 2024,
    "period_basis": "ytd",
    "period_end": "2024-06-30",
    "period_start": "2024-01-01",
    "restatement_status": "restated",
    "statement_scope": "consolidated"
  },
  "quality_flags": [
    "unit_normalized",
    "restated"
  ],
  "schema_version": "1.4.0",
  "sign_convention": "natural_statement_value",
  "source": {
    "content_hash": "28f193e0c8f4d19b4868d451d29ad47d52f0c4ba8d3bf3f34705e5f8b885e652",
    "document_id": "doc_g0_eve_2024h1_corrected",
    "license_id": null,
    "published_at": "2024-09-03T23:59:59+08:00",
    "redistribution_allowed": false,
    "retrieved_at": "2026-08-30T22:16:00+08:00",
    "source_id": "source_cninfo",
    "source_type": "official_filing",
    "uri": "https://static.cninfo.com.cn/finalpage/2024-09-03/1221114672.PDF"
  },
  "source_locator": {
    "column_label": "本期/年初至报告期末",
    "page": 62,
    "row_label": "营业收入",
    "section": "财务报表",
    "table": "合并利润表"
  },
  "value": "21659398588.08"
}
