{
  "availability": "available",
  "canonical_scale": 1,
  "company": {
    "company_id": "cn_688567",
    "country_code": "CN",
    "exchange": "SSE",
    "legal_name": "孚能科技（赣州）股份有限公司",
    "ticker": "688567"
  },
  "created_at": "2026-09-01T14:30:00+08:00",
  "currency": "CNY",
  "fact_id": "fact_v15_farasis_2023fy_operating_cash_flow",
  "fact_kind": "reported",
  "measurement_unit": "CURRENCY",
  "metric_code": "operating_cash_flow",
  "period": {
    "accounting_standard": "CAS",
    "fiscal_period": "FY",
    "fiscal_year": 2023,
    "period_basis": "ytd",
    "period_end": "2023-12-31",
    "period_start": "2023-01-01",
    "restatement_status": "as_reported",
    "statement_scope": "consolidated"
  },
  "quality_flags": [
    "unit_normalized"
  ],
  "schema_version": "1.4.0",
  "sign_convention": "natural_statement_value",
  "source": {
    "content_hash": "ecad88bf1dcd0f119eafb6694906bf54b646202f28d8e58fb578a82df6b7ccb9",
    "document_id": "doc_v15_farasis_2023fy",
    "license_id": null,
    "published_at": "2024-06-22T23:59:59+08:00",
    "redistribution_allowed": false,
    "retrieved_at": "2026-09-01T14:00:00+08:00",
    "source_id": "source_cninfo",
    "source_type": "official_filing",
    "uri": "https://static.cninfo.com.cn/finalpage/2024-06-22/1220427841.PDF"
  },
  "source_locator": {
    "column_label": "本期/年初至报告期末",
    "page": 135,
    "row_label": "经营活动产生的现金流量净额",
    "section": "财务报表",
    "table": "合并现金流量表"
  },
  "value": "664030601.12"
}
